sophoclesplaysa05campgoog_0099.png	1347 373 1548 438	ΑΙΑΣ
sophoclesplaysa05campgoog_0099.png	250 534 2660 619	do I hear thy call and seize it in my soul, as when a Tyrrhenian
sophoclesplaysa05campgoog_0099.png	249 620 2660 706	clarion speaks from mouth of bronze ! And now thou hast dis-
sophoclesplaysa05campgoog_0099.png	251 707 2660 792	cerned aright that I am hunting to and fro on the trail of a
sophoclesplaysa05campgoog_0099.png	251 793 2662 878	foeman, even Ajax of the mighty shield. ’Tis he, and no other,
sophoclesplaysa05campgoog_0099.png	251 881 1516 966	that I have been tracking so long.
sophoclesplaysa05campgoog_0099.png	346 968 2661 1061	This night he hath done to us a thing which passes thought,
sophoclesplaysa05campgoog_0099.png	251 1054 2660 1139	—if he is indeed the doer ; for we know nothing certain, but
sophoclesplaysa05campgoog_0099.png	253 1140 2659 1225	drift in doubt; and I took upon me the burden of this search.
sophoclesplaysa05campgoog_0099.png	253 1227 2660 1314	We have lately found the cattle, our spoil, dead—yea, slaughtered
sophoclesplaysa05campgoog_0099.png	254 1314 2661 1400	by human hand—and dead, beside them, the guardians of the
sophoclesplaysa05campgoog_0099.png	254 1403 475 1468	flocks.
sophoclesplaysa05campgoog_0099.png	387 1488 2658 1572	Now, all men lay this crime to him. And a scout who had
sophoclesplaysa05campgoog_0099.png	258 1828 1401 1895	δρᾶν, ποιεῖν, etc. (cp. 1324).—εἴργασται,
sophoclesplaysa05campgoog_0099.png	254 1895 1404 1962	instead of repeating ἔχει περάνας : cp.
sophoclesplaysa05campgoog_0099.png	262 1959 1407 2024	O. T. 54 ὡς εἴπερ ἄρξεις τῆσδε γῆς, ὥσπερ
sophoclesplaysa05campgoog_0099.png	256 2026 569 2088	κρατεῖς (n.).
sophoclesplaysa05campgoog_0099.png	322 2087 1408 2156	28 τρανές, ‘clear,’ like the cognate
sophoclesplaysa05campgoog_0099.png	255 2152 1401 2220	τορόν (rt. τερ, τρα, τε-τραίνω, to pierce).
sophoclesplaysa05campgoog_0099.png	256 2219 1402 2286	The adj. τρανής is not elsewhere extant
sophoclesplaysa05campgoog_0099.png	256 2285 1406 2350	but τρανῶς is used by Aesch. (Ag. 1371)
sophoclesplaysa05campgoog_0099.png	258 2349 1411 2417	and Eur. (El. 758). The form τρανός
sophoclesplaysa05campgoog_0099.png	257 2414 1410 2476	was current in later Greek ; the earliest
sophoclesplaysa05campgoog_0099.png	257 2476 1409 2545	instance seems to be Dionys. Halic. (c.
sophoclesplaysa05campgoog_0099.png	261 2545 1409 2610	25 B.C.) De Comp. Verborum c. 22 τρανὴν
sophoclesplaysa05campgoog_0099.png	259 2607 1407 2675	καὶ καθαρὰν δύναμιν.—ἀλώμεθα : this fig.
sophoclesplaysa05campgoog_0099.png	260 2675 1411 2739	sense, with ref. to uncertainty (‘to be at
sophoclesplaysa05campgoog_0099.png	260 2739 1412 2805	sea,’ as we say), belongs nowhere else to
sophoclesplaysa05campgoog_0099.png	260 2805 1406 2866	this verb, but often to πλανᾶσθαι (Her.
sophoclesplaysa05campgoog_0099.png	261 2870 1411 2942	6. 37, etc.; Plat. Hipp. Ma. 304 C πλαν-
sophoclesplaysa05campgoog_0099.png	262 2937 915 3000	ῶμαι μὲν καὶ ἀπορῶ ἀεί).
sophoclesplaysa05campgoog_0099.png	327 2996 1413 3065	24 ’θελοντής. The form ἐθελοντής
sophoclesplaysa05campgoog_0099.png	261 3065 1412 3130	occurs in Herodotus, Thucydides, Xeno-
sophoclesplaysa05campgoog_0099.png	264 3130 1414 3207	phon, and the Orators, as ἐθελοντήρ does
sophoclesplaysa05campgoog_0099.png	261 3195 1410 3262	in Od. 2. 292. On the other hand θελον-
sophoclesplaysa05campgoog_0099.png	263 3261 1416 3325	τής is cited only from Porphyrius (c. 270
sophoclesplaysa05campgoog_0099.png	262 3325 1415 3389	A. D., see Lobeck, Phryn. 7) and Hierocles
sophoclesplaysa05campgoog_0099.png	263 3388 1415 3459	(c. 450 A.D.), ap. Stob. Flor. 75. 14
sophoclesplaysa05campgoog_0099.png	266 3455 1415 3522	(p. 449. 20). Similarly ἐθελήμων is the
sophoclesplaysa05campgoog_0099.png	263 3519 1417 3588	form used by Plato (Crat. 406 A), while
sophoclesplaysa05campgoog_0099.png	263 3585 1415 3651	the earliest authority for θελήμων is Apoll.
sophoclesplaysa05campgoog_0099.png	269 3651 1417 3716	Rhod. 2. 557. In tragic iambics θέλω
sophoclesplaysa05campgoog_0099.png	265 3716 1415 3781	was naturally preferred, on metrical
sophoclesplaysa05campgoog_0099.png	264 3781 1418 3849	grounds, to ἐθέλω, though the latter
sophoclesplaysa05campgoog_0099.png	265 3846 1415 3923	occurs in tragic anapaests (as O. T. 1303,
sophoclesplaysa05campgoog_0099.png	265 3911 1418 3977	Ph. 145). If θελοντής were found in a
sophoclesplaysa05campgoog_0099.png	268 3976 1419 4054	passage where metre required it, the rarity
sophoclesplaysa05campgoog_0099.png	265 4041 1415 4108	of the form would not justify its rejection.
sophoclesplaysa05campgoog_0099.png	269 4106 1417 4171	But where, as here, aphaeresis was avail-
sophoclesplaysa05campgoog_0099.png	267 4170 1419 4236	able, it is surely more probable that the
sophoclesplaysa05campgoog_0099.png	2189 1577 2659 1641	descried him
sophoclesplaysa05campgoog_0099.png	1506 1829 2255 1897	ἀνάγκαις ταῖσδʼ ὑπέζευγμαι.
sophoclesplaysa05campgoog_0099.png	1574 1895 2664 1963	26 f. κατηναρισμένας : for ἐναρίζω
sophoclesplaysa05campgoog_0099.png	1512 1959 2664 2026	‘to slay’ (properly with the further notion
sophoclesplaysa05campgoog_0099.png	1509 2023 2662 2092	of ‘despoiling’) cp. O. C. 1733, Tr. 94.
sophoclesplaysa05campgoog_0099.png	1511 2090 2665 2159	From the cognate form κατεναίρομαι we
sophoclesplaysa05campgoog_0099.png	1510 2153 2663 2223	have κατήναρες in Ant. 871.— ἐκ χειρὸς,
sophoclesplaysa05campgoog_0099.png	1509 2219 2664 2287	by a human hand. The military sense,
sophoclesplaysa05campgoog_0099.png	1513 2285 2662 2353	‘at close quarters’ (Xen. H. 7. 2. 14 ἐνέ-
sophoclesplaysa05campgoog_0099.png	1509 2351 2666 2417	βαλον καὶ ἐκ χειρὸς ἐμάχοντο), is less fitting
sophoclesplaysa05campgoog_0099.png	1512 2413 2663 2482	here.—αὐτοῖς ποιμνίων ἐπιστάταις : cp.
sophoclesplaysa05campgoog_0099.png	1512 2481 2667 2549	fr. 873 αὐτοῖσιν ὅπλοις. The idiom occurs
sophoclesplaysa05campgoog_0099.png	1512 2545 2666 2610	in the Iliad (as 8. 24),—sometimes with
sophoclesplaysa05campgoog_0099.png	1514 2609 2666 2679	σύν added (as 14. 498), a form of it found
sophoclesplaysa05campgoog_0099.png	1513 2676 2667 2744	also, though not often, in later poetry
sophoclesplaysa05campgoog_0099.png	1514 2740 2665 2808	(Eur. Ion 32 αὐτῷ, ξὺν ἄγγει).— ἐπιστά-
sophoclesplaysa05campgoog_0099.png	1513 2807 2667 2872	ταις, ‘overseers,’ ‘masters’ or ‘guardians’
sophoclesplaysa05campgoog_0099.png	1514 2871 2668 2937	of them ; as a warrior is ὅπλων ἐπιστάτης
sophoclesplaysa05campgoog_0099.png	1516 2936 2666 3005	(Aesch. Pers. 379), and a rower, ἐρετμῶν
sophoclesplaysa05campgoog_0099.png	1516 3000 2669 3067	(Eur. Helen. 1267). Cp. Eur. fr. 188. 4
sophoclesplaysa05campgoog_0099.png	1515 3067 2668 3130	σκάπτων, ἀρῶν γῆν, ποιμνίοις ἐπιστα-
sophoclesplaysa05campgoog_0099.png	1515 3131 2670 3198	τῶν. The herdsmen being dead, there
sophoclesplaysa05campgoog_0099.png	1516 3196 2668 3263	was no one who could identify the as-
sophoclesplaysa05campgoog_0099.png	1516 3261 1709 3312	sailant.
sophoclesplaysa05campgoog_0099.png	1584 3326 2669 3380	28 πᾶς τις. The deed was found
sophoclesplaysa05campgoog_0099.png	1516 3391 2671 3457	out at dawn. Common rumour at once
sophoclesplaysa05campgoog_0099.png	1518 3455 2667 3523	pointed to Ajax. Then the ὀπτήρ (29)
sophoclesplaysa05campgoog_0099.png	1518 3521 2670 3587	informed Odysseus, who reached the tent
sophoclesplaysa05campgoog_0099.png	1518 3585 2670 3654	of Ajax very soon after the latter’s return;
sophoclesplaysa05campgoog_0099.png	1517 3652 2672 3719	as is shown by 296—304 compared with
sophoclesplaysa05campgoog_0099.png	1519 3732 1761 3783	91—113.
sophoclesplaysa05campgoog_0099.png	1583 3779 2671 3848	νέμει: cp. Galen 7. 582 (Kühn) οὐκ
sophoclesplaysa05campgoog_0099.png	1520 3847 2669 3906	ἴσην ἅπασι νέμει τὴν αἰτίαν.—The cor-
sophoclesplaysa05campgoog_0099.png	1520 3910 2671 3978	rupt τρέπει may have come from the
sophoclesplaysa05campgoog_0099.png	1520 3977 2671 4053	gloss on ἐκείνῳ..νέμει which occurs
sophoclesplaysa05campgoog_0099.png	1520 4041 2672 4108	in some of the later MSS., εἰς αὐτὸν
sophoclesplaysa05campgoog_0099.png	1520 4106 2674 4170	τρέπει. This is one of the few instances
sophoclesplaysa05campgoog_0099.png	1524 4170 2675 4238	(like Ant. 386 and 831) where a true
sophoclesplaysa05campgoog_0099.png	270 4233 1426 4302	poet wrote ἐθελοντής.—ὑπεζύγην, as if
sophoclesplaysa05campgoog_0099.png	1522 4236 2674 4303	reading, lost in L, has been preserved in other MSS. Cp. crit. notes on 44, 61.
sophoclesplaysa05campgoog_0099.png	270 4300 2676 4498	29 τις placed before its noun: 1163: Ph. 519.—ὀπτὴρ, a scout; cp. Od. 14.
sophoclesplaysa05campgoog_0099.png	268 4301 1421 4368	the task were a yoke under which he
sophoclesplaysa05campgoog_0099.png	270 4365 1423 4432	placed himself: cp. Ph. 1025 κλοπῇ τε κἀνάγκῃ ζυγείς (n.): Aesch. P. V. 108
sophoclesplaysa05campgoog_0136.png	301 384 382 456	52
sophoclesplaysa05campgoog_0136.png	1158 372 1810 481	ΣΟΦΟΛΕΟΥΣ
sophoclesplaysa05campgoog_0136.png	302 528 2032 662	ΤΕ. ἁνὴρ ἐκεῖνος, ἡνίκ’ ἦν ἐν τῇ νόσῳ,
sophoclesplaysa05campgoog_0136.png	506 632 2085 761	αὐτὸς μὲν ἥδεθ’ οἷσιν εἴχετ’ ἐν κακοῖς,
sophoclesplaysa05campgoog_0136.png	502 733 2063 841	ἡμᾶς δὲ τοὺς φρονοῦντας ἠνία ξυνών·
sophoclesplaysa05campgoog_0136.png	505 832 2113 941	νῦν δ’ ὡς ἔληξε κἀνέπνευσε τῆς νόσου,
sophoclesplaysa05campgoog_0136.png	506 939 1936 1041	κεῖνός τε λύπῃ πᾶς ἐλήλαται κακῇ
sophoclesplaysa05campgoog_0136.png	501 1034 2151 1143	ἡμεῖς θ’ ὁμοίως οὐδὲν ἧσσον ἢ πάρος.
sophoclesplaysa05campgoog_0136.png	506 1135 2199 1242	ἆρ’ ἔστι ταῦτα δὶς τόσ’ ἐξ ἁπλῶν κακά ;
sophoclesplaysa05campgoog_0136.png	306 1233 2194 1364	ΧΟ. ξύμφημι δή σοι, καὶ δέδοικα μὴ ’κ θεοῦ
sophoclesplaysa05campgoog_0136.png	502 1341 2203 1444	πληγή τις ἥκῃ. πῶς γάρ, εἰ πεπαυμένος
sophoclesplaysa05campgoog_0136.png	502 1436 2217 1546	μηδέν τι μᾶλλον ἢ νοσῶν εὐφραίνεται ;
sophoclesplaysa05campgoog_0136.png	304 1536 2235 1643	ΤΕ. ὡς ὧδ’ ἐχόντων τῶνδ’ ἐπίστασθαί σε χρή.
sophoclesplaysa05campgoog_0136.png	303 1641 2454 1744	ΧΟ. τίς γάρ ποτ’ ἀρχὴ τοῦ κακοῦ προσέπτατο ;
sophoclesplaysa05campgoog_0136.png	465 1736 2099 1866	δήλωσον ἡμῖν τοῖς ξυναλγοῦσιν τύχας.
sophoclesplaysa05campgoog_0136.png	304 1839 2145 1944	ΤΕ. ἅπαν μαθήσει τοὔργον, ὡς κοινωνὸς ὤν.
sophoclesplaysa05campgoog_0136.png	507 1942 2128 2062	κεῖνος γὰρ ἄκρας νυκτός, ἡνίχ’ ἕσπεροι
sophoclesplaysa05campgoog_0136.png	506 2036 2125 2139	λαμπτῆρες οὐκέτ’ ᾖθον, ἄμφηκες λαβὼν
sophoclesplaysa05campgoog_0136.png	2559 956 2697 1028	275
sophoclesplaysa05campgoog_0136.png	2560 1442 2703 1513	280
sophoclesplaysa05campgoog_0136.png	2557 1943 2695 2033	285
sophoclesplaysa05campgoog_0136.png	305 2227 2701 2293	271 ἀνὴρ] ἀνὴρ MSS., and Ald. 278 φρονοῦντας] In L the first corrector (S)
sophoclesplaysa05campgoog_0136.png	305 2293 2706 2358	notes, γρ. βλέποντας, which Hermann reads. 276 ἡμεῖς θ’] One MS. of Suidas
sophoclesplaysa05campgoog_0136.png	371 2552 1455 2622	272 f. οἷσιν εἴχετ’ ἐν κακοῖς = κακοῖς
sophoclesplaysa05campgoog_0136.png	306 2621 1454 2689	ἐν οἶς εἴχετο : cp. 1144 : Her. 9. 37 ἐν
sophoclesplaysa05campgoog_0136.png	304 2686 1456 2754	τούτῳ τῷ κακῷ ἐχόμενος. The antecedent
sophoclesplaysa05campgoog_0136.png	307 2748 1449 2817	κακοῖς is drawn into the relative clause,
sophoclesplaysa05campgoog_0136.png	306 2815 1453 2883	though here its case is not thereby affected:
sophoclesplaysa05campgoog_0136.png	305 2881 1453 2949	cp. Ant. 404 θάπτουσαν ὃν σὺ τὸν νεκρὸν |
sophoclesplaysa05campgoog_0136.png	306 2950 530 3014	ἀπεῖπας.
sophoclesplaysa05campgoog_0136.png	345 3008 1450 3078	φρονοῦντας is far better than the v. l.
sophoclesplaysa05campgoog_0136.png	307 3075 1458 3144	βλέποντας: it hints what is meant by
sophoclesplaysa05campgoog_0136.png	306 3144 789 3209	the vague κακοῖς.
sophoclesplaysa05campgoog_0136.png	372 3204 1457 3259	274 κἀνέπνευσε : after the actual
sophoclesplaysa05campgoog_0136.png	305 3270 1456 3340	cessation (ἔληξε), a brief space is still
sophoclesplaysa05campgoog_0136.png	306 3336 1449 3404	needed to permit ἀναπνοή. Cp. Il. 11.
sophoclesplaysa05campgoog_0136.png	306 3403 1457 3470	382 ἀνέπνευσαν κακότητος : and n. on
sophoclesplaysa05campgoog_0136.png	314 3468 669 3533	O. C. 1113 f.
sophoclesplaysa05campgoog_0136.png	374 3531 1456 3596	275 Instead of κεῖνος, we might
sophoclesplaysa05campgoog_0136.png	306 3596 1456 3648	have looked for αὐτός : but the former
sophoclesplaysa05campgoog_0136.png	306 3661 1461 3727	has been preferred, because it better
sophoclesplaysa05campgoog_0136.png	306 3726 1456 3792	marks the antithesis between Ajax and
sophoclesplaysa05campgoog_0136.png	306 3790 1456 3856	his friends.—πᾶς, adverbial : Ph. 386
sophoclesplaysa05campgoog_0136.png	308 3856 1458 3922	πόλις γάρ ἐστι πᾶσα τῶν ἡγουμένων.—
sophoclesplaysa05campgoog_0136.png	307 3920 1455 3991	ἐλήλαται: Tr. 1045 (συμφορὰς) οἵαις..
sophoclesplaysa05campgoog_0136.png	309 3984 1453 4051	ἐλαύνεται (n.). For the emphatic perf.,
sophoclesplaysa05campgoog_0136.png	309 4051 1456 4120	cp. El. 64. Here it expresses that com-
sophoclesplaysa05campgoog_0136.png	307 4115 1458 4186	plete prostration has at once followed the
sophoclesplaysa05campgoog_0136.png	308 4180 1457 4249	return of sanity: cp. Plat. Phaedo p. 80 D
sophoclesplaysa05campgoog_0136.png	310 4247 1458 4312	ἡ δὲ ψυχὴ.. ἀπαλλαττομένη τοῦ σώματος
sophoclesplaysa05campgoog_0136.png	309 4313 1308 4379	εὐθὺς διαπεφύσηται καὶ ἀπόλωλεν.
sophoclesplaysa05campgoog_0136.png	1554 2553 2703 2624	Il. I. 213 τρὶς τόσσα.. δῶρα: Eur. El.
sophoclesplaysa05campgoog_0136.png	1561 2620 2705 2687	1092 δὶς τόσως (‘in double measure’).-
sophoclesplaysa05campgoog_0136.png	1554 2682 2696 2755	ἐξ ἁπλῶν: Tr. 619 (χάρις) ἐξ ἁπλῆς διπλῆ.
sophoclesplaysa05campgoog_0136.png	1623 2749 2704 2818	278 ff. δέδοικα μὴ.. ἥκῃ. Though
sophoclesplaysa05campgoog_0136.png	1553 2812 2705 2883	ἥκει is tenable (‘I fear that it certainly
sophoclesplaysa05campgoog_0136.png	1554 2880 2705 2948	has come’ ), ἥκῃ seems better, since there
sophoclesplaysa05campgoog_0136.png	1555 2947 2705 3012	is still a real uncertainty and anxiety in
sophoclesplaysa05campgoog_0136.png	1555 3010 2703 3076	their minds. See on El. 580. (ἥκοι,
sophoclesplaysa05campgoog_0136.png	1555 3075 2713 3140	which was the common reading, is of
sophoclesplaysa05campgoog_0136.png	1556 3138 2219 3208	course impossible here.)
sophoclesplaysa05campgoog_0136.png	1617 3205 2703 3272	πῶς γάρ, sc. ἄλλῶς ἔχει; Normally,
sophoclesplaysa05campgoog_0136.png	1555 3270 2707 3337	πῶς γάρ follows a negative statement, as
sophoclesplaysa05campgoog_0136.png	1556 3334 2702 3402	in El. 911 οὐδ’ αὖ σύ· πῶς γάρ; (sc.
sophoclesplaysa05campgoog_0136.png	1554 3399 2703 3465	ἔδρασας): while πῶς γὰρ οὔ follows an
sophoclesplaysa05campgoog_0136.png	1556 3465 2702 3533	affirmative, as ib. 1307 οἶσθα μὲν τἀν-
sophoclesplaysa05campgoog_0136.png	1559 3530 2706 3598	θένδε, πῶς γὰρ οὔ; The use of πῶς γάρ
sophoclesplaysa05campgoog_0136.png	1555 3595 2706 3660	here is thus peculiar, though the sense is
sophoclesplaysa05campgoog_0136.png	1556 3661 1704 3712	clear.
sophoclesplaysa05campgoog_0136.png	1622 3723 2705 3791	εἰ πεπαυμένος κ.τ.λ. The fact that
sophoclesplaysa05campgoog_0136.png	1558 3790 2707 3857	despair has succeeded to frenzy argues
sophoclesplaysa05campgoog_0136.png	1557 3855 2707 3921	that he is under the spell of some angry
sophoclesplaysa05campgoog_0136.png	1556 3920 2701 3989	god. When the malady passed away,
sophoclesplaysa05campgoog_0136.png	1556 3985 2706 4050	his mind ought to have recovered a
sophoclesplaysa05campgoog_0136.png	1556 4050 2703 4116	healthy tone. They had already hinted
sophoclesplaysa05campgoog_0136.png	1557 4114 2556 4181	at a θεία νόσος as a possibility (186).
sophoclesplaysa05campgoog_0136.png	1625 4179 2706 4246	μηδέν τι: Eur. Andr. 1234 μηδέν τι
sophoclesplaysa05campgoog_0136.png	1557 4246 2548 4310	λίαν : Alc. 522 οὐδέν τι μᾶλλον οἶδα.
sophoclesplaysa05campgoog_0136.png	1626 4307 2706 4376	281 ὡς ὧδ’ ἐχόντων κ.τ-λ.: ὡς marks
sophoclesplaysa05campgoog_0136.png	1557 4375 2703 4442	the point of view to be taken : the gen.
sophoclesplaysa05campgoog_0136.png	310 4439 2707 4507	abs. presents the state of the facts as the
sophoclesplaysa05campgoog_0137.png	1350 368 1548 436	ΑΙΑΣ
sophoclesplaysa05campgoog_0137.png	379 533 2652 617	TE. Yon man, while frenzied, found his own joy in the dire
sophoclesplaysa05campgoog_0137.png	252 618 2652 709	fantasies that held him, though his presence was grievous to us
sophoclesplaysa05campgoog_0137.png	249 707 2653 792	who were sane ; but now, since he hath had pause and respite
sophoclesplaysa05campgoog_0137.png	250 792 2653 878	from the plague, he is utterly afflicted with sore grief, and we
sophoclesplaysa05campgoog_0137.png	254 879 2647 959	likewise, no less than before. Have we not here two sorrows,
sophoclesplaysa05campgoog_0137.png	91 966 827 1055	instead of one ?
sophoclesplaysa05campgoog_0137.png	383 1052 2650 1138	CH. Yea verily: and I fear lest the stroke of a god hath
sophoclesplaysa05campgoog_0137.png	251 1139 2652 1225	fallen. How else, if his spirit is no lighter, now that the malady
sophoclesplaysa05campgoog_0137.png	252 1227 1627 1311	is overpast, than when it vexed him ?
sophoclesplaysa05campgoog_0137.png	381 1312 2093 1392	TE. Thus stands the matter, be well assured.
sophoclesplaysa05campgoog_0137.png	383 1394 2651 1487	CH. And in what wise did the plague first swoop upon him ?
sophoclesplaysa05campgoog_0137.png	251 1486 2028 1571	Declare to us, who share thy pain, how it befell.
sophoclesplaysa05campgoog_0137.png	382 1573 2653 1657	TE. Thou shalt hear all that chanced, as one who hath part
sophoclesplaysa05campgoog_0137.png	250 1660 2654 1750	therein. At dead of night, when the evening lamps no longer
sophoclesplaysa05campgoog_0137.png	1499 1747 2650 1830	burned, he seized a two-edged
sophoclesplaysa05campgoog_0137.png	250 1905 2653 1974	(s. v. ἐξ ἁπλῶν), viz. V (the Vossianus, at Leyden), has ἡμεῖς δ’: but this is doubtless
sophoclesplaysa05campgoog_0137.png	249 1970 2652 2040	a mere slip, due to v. 273. 277 ἆρ’ ἔστι] ἄρ εστὶ L. 278 μὴ ’κ θεοῦ] Blaydes
sophoclesplaysa05campgoog_0137.png	249 2035 2653 2106	conj. μὴ θεοῦ. 279 ἤκῃ Suidas (s. v. δέδοικα) : ἤκοι L, A, with most MSS., and
sophoclesplaysa05campgoog_0137.png	250 2103 2651 2169	Ald.: but a few have ἥκῃ, ἥκη, or ἥκει.—πεπαυμένος] πεπαυμένης Aug. b. 288 ξυν-
sophoclesplaysa05campgoog_0137.png	251 2168 1537 2231	αλγοῦσι L, A, Γ, etc.—Nauck writes τύχαις.
sophoclesplaysa05campgoog_0137.png	249 2409 1400 2476	condition under which one’s opinion must
sophoclesplaysa05campgoog_0137.png	250 2474 1403 2541	be formed. Cp. Aesch. P. V. 760 ὡς
sophoclesplaysa05campgoog_0137.png	250 2538 1397 2617	τοίνυν ὄντων τῶνδέ σοι μαθεῖν πάρα. Eur.
sophoclesplaysa05campgoog_0137.png	250 2603 1400 2671	Med. 1311 ὡς οὐκέτ’ ὄντων σῶν τέκνων
sophoclesplaysa05campgoog_0137.png	250 2668 1398 2738	φρόντιζε δή. Thuc. 7. 15 § I ὡς .. τῶν
sophoclesplaysa05campgoog_0137.png	248 2736 1401 2802	στρατιωτῶν.. μὴ μεμπτῶν γεγενημένων
sophoclesplaysa05campgoog_0137.png	252 2800 1397 2865	οὔτω τὴν γνώμην ἔχετε. Xen. An. I. 3.
sophoclesplaysa05campgoog_0137.png	252 2863 1400 2927	6 ὡς ἐμοῦ οὖν ἰόντος ὅπῃ ἂν καὶ ὑμεῖς, οὔτω
sophoclesplaysa05campgoog_0137.png	250 2929 1394 2997	τὴν γνώμην ἔχετε. See also below, 904,
sophoclesplaysa05campgoog_0137.png	251 2997 363 3061	981.
sophoclesplaysa05campgoog_0137.png	317 3056 1394 3126	282 f. τίς γάρ : for γάρ in question,
sophoclesplaysa05campgoog_0137.png	250 3123 1400 3191	cp. Ph. 161, 327, 651 —προσέπτατο, as
sophoclesplaysa05campgoog_0137.png	252 3190 1398 3258	if winged to its aim by the god ; Aesch.
sophoclesplaysa05campgoog_0137.png	252 3253 1403 3319	P. V. 644 (the heaven-sent trouble) ὅθεν
sophoclesplaysa05campgoog_0137.png	250 3320 1401 3388	μοι σχετλίᾳ προσέπτατο : Eur. Alc. 420
sophoclesplaysa05campgoog_0137.png	251 3383 1205 3449	κοὐκ ἄφνω κακὸν τόδε | προσέπτατ’.
sophoclesplaysa05campgoog_0137.png	318 3449 1398 3518	From the Homeric ἔπτατο (Il. 13. 592,
sophoclesplaysa05campgoog_0137.png	250 3515 1400 3580	etc.) Tragedy borrows this non-thematic
sophoclesplaysa05campgoog_0137.png	249 3579 1400 3647	aor. (of which the active form would be
sophoclesplaysa05campgoog_0137.png	251 3644 1399 3711	ἔπτην): cp. 693. The aor. of πέτομαι in
sophoclesplaysa05campgoog_0137.png	250 3708 1398 3774	Attic Comedy and prose is usu. ἐπτόμην
sophoclesplaysa05campgoog_0137.png	253 3774 1398 3854	(see Veitch, Irreg. Verbs, 2nd ed., p. 530) :
sophoclesplaysa05campgoog_0137.png	249 3839 1399 3906	and of this we have the inf. πτέσθαι in
sophoclesplaysa05campgoog_0137.png	255 3905 1400 3972	O. T. 17,—again in accord with Homeric
sophoclesplaysa05campgoog_0137.png	249 3967 1177 4037	precedent (Il. 4. 126 ἐπιπτέσθαι).
sophoclesplaysa05campgoog_0137.png	313 4031 1399 4101	τύχας depends on δήλωσον. The
sophoclesplaysa05campgoog_0137.png	249 4099 1398 4167	change to τύχαις, dependent on ξυναλ-
sophoclesplaysa05campgoog_0137.png	1501 2409 2653 2476	means here, ‘at dead of night.’ The
sophoclesplaysa05campgoog_0137.png	1500 2474 2652 2541	only other instance of ἄκρος so used
sophoclesplaysa05campgoog_0137.png	1503 2539 2653 2608	(natural though the use is) seems to be
sophoclesplaysa05campgoog_0137.png	1500 2604 2651 2672	Theocr. 11. 36 τυρὸς δ’ οὐ λείπει μ’ οὔτ’ ἐν
sophoclesplaysa05campgoog_0137.png	1502 2667 2653 2737	θέρει οὔτ’ ἐν ὀπώρῃ, | οὐ χειμῶνος ἄκρω
sophoclesplaysa05campgoog_0137.png	1504 2732 2654 2801	(‘depth of winter’). Elsewhere ἄκρα
sophoclesplaysa05campgoog_0137.png	1500 2798 2660 2867	νύξ means either (1) the beginning of
sophoclesplaysa05campgoog_0137.png	1500 2865 2653 2932	night, nightfall, as in Aratus 775 ἄκρῃ
sophoclesplaysa05campgoog_0137.png	1499 2930 2651 2996	νυκτί: or (2) the verge between night
sophoclesplaysa05campgoog_0137.png	1501 2992 2652 3060	and dawn, as ib. 308 ἀκρόθι νυκτός. In
sophoclesplaysa05campgoog_0137.png	1500 3060 2652 3126	Theophrastus De Sign. Pluv. 1. § 2 (p.
sophoclesplaysa05campgoog_0137.png	1504 3122 2652 3190	389 ed. Wimmer) the ἀκρόνυχοι ἀνα-
sophoclesplaysa05campgoog_0137.png	1500 3187 2651 3256	τολαί of stars are their risings ὅταν ἅμα
sophoclesplaysa05campgoog_0137.png	1502 3254 2653 3318	δυομένῳ ἀνατέλλῃ (τὰ ἄστρα), i.e. soon
sophoclesplaysa05campgoog_0137.png	1500 3315 2659 3386	after sunset, at nightfall. The sense of
sophoclesplaysa05campgoog_0137.png	1502 3380 2650 3449	ἀκρέσπερος varies like that of ἄκρα νύξ.
